{"$schema":"https://json-schema.org/draft/2020-12/schema","$id":"https://schemas.rotprods.dev/clever/v1/action-receipt.schema.json","type":"object","additionalProperties":false,"required":["contractVersion","receiptId","actionId","idempotencyKey","status","attempt","startedAt"],"properties":{"contractVersion":{"$ref":"https://schemas.rotprods.dev/clever/v1/common.schema.json#/$defs/contractVersion"},"receiptId":{"type":"string","minLength":1},"actionId":{"type":"string","minLength":1},"idempotencyKey":{"type":"string","minLength":1},"status":{"type":"string","enum":["ACTION_RECEIPT_STATUS_ACCEPTED","ACTION_RECEIPT_STATUS_RUNNING","ACTION_RECEIPT_STATUS_SUCCEEDED","ACTION_RECEIPT_STATUS_FAILED","ACTION_RECEIPT_STATUS_DENIED","ACTION_RECEIPT_STATUS_DUPLICATE","ACTION_RECEIPT_STATUS_ROLLED_BACK"]},"attempt":{"type":"integer","minimum":0},"startedAt":{"$ref":"https://schemas.rotprods.dev/clever/v1/common.schema.json#/$defs/timestamp"},"completedAt":{"$ref":"https://schemas.rotprods.dev/clever/v1/common.schema.json#/$defs/timestamp"},"result":{"$ref":"https://schemas.rotprods.dev/clever/v1/common.schema.json#/$defs/payload"},"verificationCodes":{"type":"array","items":{"type":"string"}},"errorCode":{"type":"string"},"errorMessage":{"type":"string"},"auditRef":{"type":"string"}}}
