{"contractVersion":{"major":1,"minor":0},"receiptId":"rcpt_demo","actionId":"act_demo","idempotencyKey":"idem_demo","status":"ACTION_RECEIPT_STATUS_SUCCEEDED","attempt":1,"startedAt":"2026-09-01T00:00:00Z","completedAt":"2026-09-01T00:00:01Z","result":{"schemaUri":"clever://actions/result/v1","contentType":"application/json","data":"eyJvayI6dHJ1ZX0="},"verificationCodes":["POSTCONDITION_VERIFIED"],"auditRef":"audit_demo"}
